{
  "version": "1.0",
  "ticker": "TEP",
  "currency": "EUR",
  "scale": "mixed",
  "scale_notes": "Monetary fields in millions as stated in press release financial statements. EPS and dividends_per_share in raw euros. total_debt = non-current + current financial liabilities (excluding lease liabilities per IFRS 16). total_equity = total equity including non-controlling interests where applicable.",
  "periods": {
    "FY2025": {
      "fecha_fin": "2025-12-31",
      "tipo_periodo": "anual",
      "fields": {
        "ingresos": {"value": 10209, "source_filing": "tp-press-release-2025-annual-results.txt"},
        "ebit": {"value": 1055, "source_filing": "tp-press-release-2025-annual-results.txt"},
        "net_income": {"value": 497, "source_filing": "tp-press-release-2025-annual-results.txt"},
        "eps_basic": {"value": 8.47, "source_filing": "tp-press-release-2025-annual-results.txt"},
        "eps_diluted": {"value": 8.40, "source_filing": "tp-press-release-2025-annual-results.txt"},
        "income_tax": {"value": 289, "source_filing": "tp-press-release-2025-annual-results.txt"},
        "interest_expense": {"value": 212, "source_filing": "tp-press-release-2025-annual-results.txt"},
        "depreciation_amortization": {"value": 268, "source_filing": "tp-press-release-2025-annual-results.txt"},
        "dividends_per_share": {"value": 4.50, "source_filing": "tp-press-release-2025-annual-results.txt"},
        "total_assets": {"value": 11479, "source_filing": "tp-press-release-2025-annual-results.txt"},
        "total_liabilities": {"value": 7382, "source_filing": "tp-press-release-2025-annual-results.txt"},
        "total_equity": {"value": 4097, "source_filing": "tp-press-release-2025-annual-results.txt"},
        "cash_and_equivalents": {"value": 996, "source_filing": "tp-press-release-2025-annual-results.txt"},
        "total_debt": {"value": 4185, "source_filing": "tp-press-release-2025-annual-results.txt"},
        "cfo": {"value": 1614, "source_filing": "tp-press-release-2025-annual-results.txt"},
        "capex": {"value": -253, "source_filing": "tp-press-release-2025-annual-results.txt"}
      }
    },
    "FY2024": {
      "fecha_fin": "2024-12-31",
      "tipo_periodo": "anual",
      "fields": {
        "ingresos": {"value": 10280, "source_filing": "tp-press-release-2025-annual-results.txt"},
        "ebit": {"value": 1082, "source_filing": "tp-press-release-2025-annual-results.txt"},
        "net_income": {"value": 523, "source_filing": "tp-press-release-2025-annual-results.txt"},
        "eps_basic": {"value": 8.76, "source_filing": "tp-press-release-2025-annual-results.txt"},
        "eps_diluted": {"value": 8.71, "source_filing": "tp-press-release-2025-annual-results.txt"},
        "income_tax": {"value": 346, "source_filing": "tp-press-release-2025-annual-results.txt"},
        "interest_expense": {"value": 214, "source_filing": "tp-press-release-2025-annual-results.txt"},
        "depreciation_amortization": {"value": 293, "source_filing": "tp-press-release-2025-annual-results.txt"},
        "dividends_per_share": {"value": 4.20, "source_filing": "tp-press-release-2025-annual-results.txt"},
        "total_assets": {"value": 12074, "source_filing": "tp-press-release-2025-annual-results.txt"},
        "total_liabilities": {"value": 7518, "source_filing": "tp-press-release-2025-annual-results.txt"},
        "total_equity": {"value": 4556, "source_filing": "tp-press-release-2025-annual-results.txt"},
        "cash_and_equivalents": {"value": 1058, "source_filing": "tp-press-release-2025-annual-results.txt"},
        "total_debt": {"value": 4154, "source_filing": "tp-press-release-2025-annual-results.txt"},
        "cfo": {"value": 1813, "source_filing": "tp-press-release-2025-annual-results.txt"},
        "capex": {"value": -219, "source_filing": "tp-press-release-2025-annual-results.txt"}
      }
    },
    "FY2023": {
      "fecha_fin": "2023-12-31",
      "tipo_periodo": "anual",
      "fields": {
        "ingresos": {"value": 8345, "source_filing": "SRC_001_ANNUAL_REPORT_2024-12-31.txt"},
        "ebit": {"value": 998, "source_filing": "SRC_001_ANNUAL_REPORT_2024-12-31.txt"},
        "net_income": {"value": 592, "source_filing": "SRC_001_ANNUAL_REPORT_2024-12-31.txt"},
        "eps_basic": {"value": 10.09, "source_filing": "SRC_001_ANNUAL_REPORT_2024-12-31.txt"},
        "eps_diluted": {"value": 10.01, "source_filing": "SRC_001_ANNUAL_REPORT_2024-12-31.txt"},
        "income_tax": {"value": 228, "source_filing": "SRC_001_ANNUAL_REPORT_2024-12-31.txt"},
        "interest_expense": {"value": 126, "source_filing": "SRC_001_ANNUAL_REPORT_2024-12-31.txt"},
        "depreciation_amortization": {"value": 266, "source_filing": "SRC_001_ANNUAL_REPORT_2024-12-31.txt"},
        "dividends_per_share": {"value": 3.85, "source_filing": "SRC_001_ANNUAL_REPORT_2024-12-31.txt"},
        "total_assets": {"value": 12068, "source_filing": "SRC_001_ANNUAL_REPORT_2024-12-31.txt"},
        "total_liabilities": {"value": 7844, "source_filing": "SRC_001_ANNUAL_REPORT_2024-12-31.txt"},
        "total_equity": {"value": 4224, "source_filing": "SRC_001_ANNUAL_REPORT_2024-12-31.txt"},
        "cash_and_equivalents": {"value": 882, "source_filing": "SRC_001_ANNUAL_REPORT_2024-12-31.txt"},
        "total_debt": {"value": 4600, "source_filing": "SRC_001_ANNUAL_REPORT_2024-12-31.txt"},
        "cfo": {"value": 1375, "source_filing": "SRC_001_ANNUAL_REPORT_2024-12-31.txt"},
        "capex": {"value": -233, "source_filing": "SRC_001_ANNUAL_REPORT_2024-12-31.txt"}
      }
    }
  }
}