{
  "version": "1.0",
  "ticker": "DNOW",
  "currency": "USD",
  "period_scope": "FULL",
  "restatement_policy": "as_reported_unless_explicit_restatement",
  "scale": "as_reported",
  "scale_notes": "Annual values curated from local SEC 10-K artifacts for BL-092 tranche A. Monetary values are stored as reported in filing presentation.",
  "periods": {
    "FY2024": {
      "fecha_fin": "2024-12-31",
      "tipo_periodo": "anual",
      "fields": {
        "ingresos": {
          "value": 2373.0,
          "source_filing": "SRC_001_10-K_FY2025.htm"
        },
        "ebit": {
          "value": 109.0,
          "source_filing": "SRC_001_10-K_FY2025.htm"
        },
        "net_income": {
          "value": 79.0,
          "source_filing": "SRC_001_10-K_FY2025.htm"
        },
        "total_assets": {
          "value": 1621.0,
          "source_filing": "SRC_001_10-K_FY2025.htm"
        },
        "total_liabilities": {
          "value": 493.0,
          "source_filing": "SRC_001_10-K_FY2025.htm"
        },
        "total_equity": {
          "value": 1128.0,
          "source_filing": "SRC_001_10-K_FY2025.htm"
        },
        "cash_and_equivalents": {
          "value": 256.0,
          "source_filing": "SRC_001_10-K_FY2025.htm"
        },
        "cfo": {
          "value": 298.0,
          "source_filing": "SRC_001_10-K_FY2025.htm"
        },
        "capex": {
          "value": -9.0,
          "source_filing": "SRC_001_10-K_FY2025.htm"
        },
        "shares_outstanding": {
          "value": 106.0,
          "source_filing": "SRC_002_10-K_FY2024.htm"
        }
      }
    },
    "FY2025": {
      "fecha_fin": "2025-12-31",
      "tipo_periodo": "anual",
      "fields": {
        "ingresos": {
          "value": 2820.0,
          "source_filing": "SRC_001_10-K_FY2025.htm"
        },
        "ebit": {
          "value": -93.0,
          "source_filing": "SRC_001_10-K_FY2025.htm"
        },
        "net_income": {
          "value": -88.0,
          "source_filing": "SRC_001_10-K_FY2025.htm"
        },
        "total_assets": {
          "value": 3924.0,
          "source_filing": "SRC_001_10-K_FY2025.htm"
        },
        "total_liabilities": {
          "value": 1686.0,
          "source_filing": "SRC_001_10-K_FY2025.htm"
        },
        "total_equity": {
          "value": 2238.0,
          "source_filing": "SRC_001_10-K_FY2025.htm"
        },
        "cash_and_equivalents": {
          "value": 164.0,
          "source_filing": "SRC_001_10-K_FY2025.htm"
        },
        "cfo": {
          "value": 155.0,
          "source_filing": "SRC_001_10-K_FY2025.htm"
        },
        "capex": {
          "value": -21.0,
          "source_filing": "SRC_001_10-K_FY2025.htm"
        },
        "shares_outstanding": {
          "value": 118.0,
          "source_filing": "SRC_001_10-K_FY2025.htm"
        }
      }
    }
  }
}
