{
  "version": "1.0",
  "ticker": "KAR",
  "currency": "USD",
  "scale": "mixed",
  "scale_notes": "Monetary fields in millions USD as stated in filing financial statements (US$M column headers). EPS in cents per share as stated. Depreciation_amortization from financial summary (excludes FPSO ROU asset). total_debt = borrowings + other financial liabilities (additive). Interest_expense = Finance costs from income statement. shares_outstanding = weighted average basic shares.",
  "restatement_policy": "as_reported_unless_explicit_restatement",
  "periods": {
    "FY2025": {
      "fecha_fin": "2025-12-31",
      "tipo_periodo": "anual",
      "fields": {
        "ingresos": {
          "value": 628.6,
          "source_filing": "SRC_001_annual_FY2025.txt"
        },
        "cost_of_revenue": {
          "value": 387.3,
          "source_filing": "SRC_001_annual_FY2025.txt"
        },
        "gross_profit": {
          "value": 241.3,
          "source_filing": "SRC_001_annual_FY2025.txt"
        },
        "ebitda": {
          "value": 380.7,
          "source_filing": "SRC_001_annual_FY2025.txt"
        },
        "depreciation_amortization": {
          "value": 167.3,
          "source_filing": "SRC_001_annual_FY2025.txt"
        },
        "net_income": {
          "value": 125.5,
          "source_filing": "SRC_001_annual_FY2025.txt"
        },
        "eps_basic": {
          "value": 16.94,
          "source_filing": "SRC_001_annual_FY2025.txt"
        },
        "eps_diluted": {
          "value": 16.78,
          "source_filing": "SRC_001_annual_FY2025.txt"
        },
        "interest_expense": {
          "value": 80.9,
          "source_filing": "SRC_001_annual_FY2025.txt"
        },
        "income_tax": {
          "value": 17.7,
          "source_filing": "SRC_001_annual_FY2025.txt"
        },
        "total_assets": {
          "value": 1773.6,
          "source_filing": "SRC_001_annual_FY2025.txt"
        },
        "total_liabilities": {
          "value": 741.1,
          "source_filing": "SRC_001_annual_FY2025.txt"
        },
        "total_equity": {
          "value": 1032.5,
          "source_filing": "SRC_001_annual_FY2025.txt"
        },
        "cash_and_equivalents": {
          "value": 206.1,
          "source_filing": "SRC_001_annual_FY2025.txt"
        },
        "total_debt": {
          "value": 371.9,
          "source_filing": "SRC_001_annual_FY2025.txt"
        },
        "cfo": {
          "value": 251.4,
          "source_filing": "SRC_001_annual_FY2025.txt"
        },
        "shares_outstanding": {
          "value": 741043505,
          "source_filing": "SRC_001_annual_FY2025.txt"
        },
        "cff": {
          "value": -100.5,
          "source_filing": "SRC_001_annual_FY2025.txt"
        },
        "cfi": {
          "value": -288.5,
          "source_filing": "SRC_001_annual_FY2025.txt"
        },
        "delta_cash": {
          "value": -137.6,
          "source_filing": "SRC_001_annual_FY2025.txt"
        },
        "inventories": {
          "value": 10.5,
          "source_filing": "SRC_001_annual_FY2025.txt"
        }
      }
    },
    "FY2024": {
      "fecha_fin": "2024-12-31",
      "tipo_periodo": "anual",
      "fields": {
        "ingresos": {
          "value": 776.5,
          "source_filing": "SRC_003_annual_FY2024.txt"
        },
        "cost_of_revenue": {
          "value": 397.4,
          "source_filing": "SRC_003_annual_FY2024.txt"
        },
        "gross_profit": {
          "value": 379.1,
          "source_filing": "SRC_003_annual_FY2024.txt"
        },
        "ebitda": {
          "value": 450.3,
          "source_filing": "SRC_001_annual_FY2025.txt"
        },
        "depreciation_amortization": {
          "value": 164.8,
          "source_filing": "SRC_001_annual_FY2025.txt"
        },
        "net_income": {
          "value": 127.5,
          "source_filing": "SRC_003_annual_FY2024.txt"
        },
        "eps_basic": {
          "value": 16.07,
          "source_filing": "SRC_003_annual_FY2024.txt"
        },
        "eps_diluted": {
          "value": 15.97,
          "source_filing": "SRC_003_annual_FY2024.txt"
        },
        "interest_expense": {
          "value": 69.3,
          "source_filing": "SRC_003_annual_FY2024.txt"
        },
        "income_tax": {
          "value": 111.8,
          "source_filing": "SRC_003_annual_FY2024.txt"
        },
        "total_assets": {
          "value": 1941.5,
          "source_filing": "SRC_003_annual_FY2024.txt"
        },
        "total_liabilities": {
          "value": 965.1,
          "source_filing": "SRC_003_annual_FY2024.txt"
        },
        "total_equity": {
          "value": 976.4,
          "source_filing": "SRC_003_annual_FY2024.txt"
        },
        "cash_and_equivalents": {
          "value": 341.2,
          "source_filing": "SRC_003_annual_FY2024.txt"
        },
        "total_debt": {
          "value": 476.5,
          "source_filing": "SRC_003_annual_FY2024.txt"
        },
        "cfo": {
          "value": 434.6,
          "source_filing": "SRC_003_annual_FY2024.txt"
        },
        "shares_outstanding": {
          "value": 793823809,
          "source_filing": "SRC_001_annual_FY2025.txt"
        },
        "cff": {
          "value": -37.2,
          "source_filing": "SRC_003_annual_FY2024.txt"
        },
        "cfi": {
          "value": -218.6,
          "source_filing": "SRC_003_annual_FY2024.txt"
        },
        "delta_cash": {
          "value": 178.8,
          "source_filing": "SRC_003_annual_FY2024.txt"
        },
        "inventories": {
          "value": 10.5,
          "source_filing": "SRC_003_annual_FY2024.txt"
        }
      }
    },
    "FY2023": {
      "fecha_fin": "2023-12-31",
      "tipo_periodo": "anual",
      "fields": {
        "ingresos": {
          "value": 412.9,
          "source_filing": "SRC_003_annual_FY2024.txt"
        },
        "cost_of_revenue": {
          "value": 164.5,
          "source_filing": "SRC_003_annual_FY2024.txt"
        },
        "gross_profit": {
          "value": 248.4,
          "source_filing": "SRC_003_annual_FY2024.txt"
        },
        "net_income": {
          "value": 122.5,
          "source_filing": "SRC_003_annual_FY2024.txt"
        },
        "eps_basic": {
          "value": 20.18,
          "source_filing": "SRC_003_annual_FY2024.txt"
        },
        "eps_diluted": {
          "value": 20.03,
          "source_filing": "SRC_003_annual_FY2024.txt"
        },
        "interest_expense": {
          "value": 15.9,
          "source_filing": "SRC_003_annual_FY2024.txt"
        },
        "income_tax": {
          "value": 59.6,
          "source_filing": "SRC_003_annual_FY2024.txt"
        },
        "total_assets": {
          "value": 1932.5,
          "source_filing": "SRC_003_annual_FY2024.txt"
        },
        "total_liabilities": {
          "value": 1018.5,
          "source_filing": "SRC_003_annual_FY2024.txt"
        },
        "total_equity": {
          "value": 914.0,
          "source_filing": "SRC_003_annual_FY2024.txt"
        },
        "cash_and_equivalents": {
          "value": 170.4,
          "source_filing": "SRC_003_annual_FY2024.txt"
        },
        "total_debt": {
          "value": 486.9,
          "source_filing": "SRC_003_annual_FY2024.txt"
        },
        "cfo": {
          "value": 303.4,
          "source_filing": "SRC_003_annual_FY2024.txt"
        },
        "shares_outstanding": {
          "value": 606743713,
          "source_filing": "SRC_001_annual_FY2025.txt"
        },
        "cff": {
          "value": 519.8,
          "source_filing": "SRC_003_annual_FY2024.txt"
        },
        "cfi": {
          "value": -728.1,
          "source_filing": "SRC_003_annual_FY2024.txt"
        },
        "delta_cash": {
          "value": 95.1,
          "source_filing": "SRC_003_annual_FY2024.txt"
        },
        "inventories": {
          "value": 10.8,
          "source_filing": "SRC_003_annual_FY2024.txt"
        }
      }
    }
  }
}
